user_input,reference_contexts,reference,synthesizer_name
Firestore에서 백업 정보를 조회하려면 어떤 권한이 필요한가요?,['Q: Firestore에서 백업 정보를 조회하기 위해 필요한 권한은 무엇인가요?\nA: Firestore에서 백업 정보를 조회하기 위해 필요한 권한은 다음과 같습니다: \n- datastore.backups.get \n- datastore.backups.list'],Firestore에서 백업 정보를 조회하기 위해서는 datastore.backups.get과 datastore.backups.list 권한이 필요합니다.,single_hop_specific_query_synthesizer
PHP Firestore add() 메서드 예시에서 Japan 값은 어떻게 사용되나요?,"[""Q: PHP에서 Firestore에 문서를 추가할 때 사용하는 add() 메서드의 예시는 무엇인가요?\nA: PHP에서 Firestore에 문서를 추가할 때 사용하는 add() 메서드의 예시는 다음과 같습니다.\n\n```php\n$data = [\n\t'name' => 'Tokyo',\n\t'country' => 'Japan'\n];\n$addedDocRef = $db->collection('samples/php/cities')->add($data);\nprintf('Added document with ID: %s' . PHP_EOL, $addedDocRef->id());\n```""]",PHP Firestore add() 메서드 예시에서 Japan 값은 country 필드의 값으로 사용됩니다.,single_hop_specific_query_synthesizer
type 필드 언제 생략대요?,"[""Q: StandardSqlField에서 'type' 필드가 생략될 수 있는 경우는 어떤 경우인가요?\nA: 'type' 필드는 명시적으로 지정되지 않은 경우에 생략될 수 있습니다. 예를 들어, CREATE FUNCTION 문에서 반환 유형을 생략할 수 있습니다.""]",'type' 필드는 명시적으로 지정되지 않은 경우에 생략될 수 있습니다.,single_hop_specific_query_synthesizer
BUCKET_NAME 뭐에요?,"['Q: ExportDocuments 메서드를 호출할 때, 어떤 형식의 URI를 출력 URI로 지정해야 하나요?\nA: ExportDocuments 메서드를 호출할 때, 출력 URI(output_uri_prefix)는 Google Cloud Storage URI 형식이어야 하며, 다음과 같은 형식을 따라야 합니다: gs://BUCKET_NAME[/NAMESPACE_PATH]. 여기서 BUCKET_NAME은 Google Cloud Storage 버킷의 이름이고, NAMESPACE_PATH는 선택적 Google Cloud Storage 네임스페이스 경로입니다.']",BUCKET_NAME은 Google Cloud Storage 버킷의 이름입니다.,single_hop_specific_query_synthesizer
Google OAuth 2.0 서버에 요청을 전송할 때 어떤 엔드포인트를 사용해야 하나요?,"['Q: Google의 OAuth 2.0 서버에 요청을 전송하는 방법은 무엇인가요?\nA: 사용자 승인을 받으려면 https://accounts.google.com/o/oauth2/v2/auth에서 Google 승인 서버에 요청을 전송하세요. 이 엔드포인트는 활성 세션 조회를 처리하고, 사용자를 인증하고, 사용자 동의를 획득합니다. 엔드포인트는 SSL을 통해서만 액세스할 수 있으며 HTTP (비 SSL) 연결은 거부합니다.']",Google OAuth 2.0 서버에 요청을 전송하려면 https://accounts.google.com/o/oauth2/v2/auth 엔드포인트를 사용해야 합니다.,single_hop_specific_query_synthesizer
peopleService 쓰면 연락처 삭제 어떻게 해요?,"['Q: 기존 연락처를 삭제하기 위한 Python 코드 예시는 무엇인가요?\nA: 기존 연락처를 삭제하기 위한 Python 코드는 다음과 같습니다.\n```python\npeopleService.people().deleteContact(""resource_name"").execute()\n```']","peopleService.people().deleteContact(""resource_name"").execute() 코드를 사용하면 기존 연락처를 삭제할 수 있습니다.",single_hop_specific_query_synthesizer
"OPEN API를 처음 사용하는 사람으로서, projects.databases.collectionGroups.fields.get 메서드의 성공적인 응답에 포함된 Field 인스턴스에 대해 더 자세히 알고 싶습니다. Field 문서가 무엇이며, 이 문서를 참고하면 어떤 정보를 얻을 수 있는지 설명해 주실 수 있나요?",['Q: projects.databases.collectionGroups.fields.get 메서드의 성공적인 응답은 어떤 형식인가요?\nA: 성공적인 응답 본문은 Field 인스턴스를 포함합니다. Field에 대한 자세한 내용은 [Field 문서](https://cloud.google.com/firestore/docs/reference/rest/v1/projects.databases.collectionGroups.fields#Field)를 참조하세요.'],projects.databases.collectionGroups.fields.get 메서드의 성공적인 응답 본문에는 Field 인스턴스가 포함되어 있습니다. Field에 대한 자세한 내용은 Field 문서를 참조하실 수 있습니다. Field 문서는 Field 인스턴스에 대한 정보를 제공하는 자료입니다.,single_hop_specific_query_synthesizer
캘린더에 이벤드 공유하려면 어떤 필드 써야되나요? 캘린더에서 공유 속성 추가하는 방법 자세히 알려주세요.,['Q: 이벤트에 공유 속성을 추가하려면 어떤 필드를 사용해야 하나요?\nA: 이벤트에 공유 속성을 추가하려면 `extendedProperties.shared` 필드를 사용해야 합니다. 이 필드는 다른 참석자의 캘린더에 있는 일정 사본 간에 공유되는 속성을 포함하는 객체입니다.'],이벤트에 공유 속성을 추가하려면 `extendedProperties.shared` 필드를 사용해야 합니다. 이 필드는 다른 참석자의 캘린더에 있는 일정 사본 간에 공유되는 속성을 포함하는 객체입니다.,single_hop_specific_query_synthesizer
usercreds 비활성화 하면 응답에 usercreds 정보가 어떻게 나오는지 자세히 알려주세여 usercreds가 뭔지도 잘 모르겠어요,['Q: userCreds 비활성화 요청의 성공적인 응답은 어떤 형태인가요?\nA: userCreds 비활성화 요청이 성공하면 응답 본문에는 `UserCreds` 인스턴스가 포함됩니다. 이 인스턴스는 비활성화된 userCreds에 대한 정보를 담고 있습니다.'],userCreds 비활성화 요청이 성공하면 응답 본문에는 UserCreds 인스턴스가 포함됩니다. 이 인스턴스는 비활성화된 userCreds에 대한 정보를 담고 있습니다.,single_hop_specific_query_synthesizer
"나 Search Ads 360 API 쓰고 싶은데 광고 데이터 보려면 무슨 OAuth 2.0 범위 써야 되는지 잘 모르겠어요, 알려줄 수 있나요?",['Q: Search Ads 360 API에서 광고 데이터를 보기 위해 필요한 OAuth 2.0 범위는 무엇인가요?\nA: Search Ads 360 API에서 광고 데이터를 보기 위해 필요한 OAuth 2.0 범위는 https://www.googleapis.com/auth/doubleclicksearch입니다.'],Search Ads 360 API에서 광고 데이터를 보기 위해 필요한 OAuth 2.0 범위는 https://www.googleapis.com/auth/doubleclicksearch입니다.,single_hop_specific_query_synthesizer
"me want know how HTTP work for update calendar metadata, can you tell me what HTTP request look like and what calendarId mean, because I expert but want more detail, explain long way?",['Q: 캘린더의 메타데이터를 업데이트하기 위한 HTTP 요청은 어떻게 구성하나요?\nA: 캘린더의 메타데이터를 업데이트하기 위해서는 다음과 같은 HTTP 요청을 사용합니다:\n\n```\nPUT https://www.googleapis.com/calendar/v3/calendars/calendarId\n```\n여기서 `calendarId`는 업데이트할 캘린더의 식별자입니다.'],캘린더의 메타데이터를 업데이트하기 위해서는 다음과 같은 HTTP 요청을 사용합니다: PUT https://www.googleapis.com/calendar/v3/calendars/calendarId 여기서 calendarId는 업데이트할 캘린더의 식별자입니다.,single_hop_specific_query_synthesizer
Google 프로젝트 소유자와 편집자가 관리해야 할 주요 사항은 무엇인가요?,"['Q: 프로젝트 소유자와 편집자가 알아야 할 사항은 무엇인가요?\nA: 프로젝트 소유자와 편집자는 최신 상태를 유지해야 하며, 프로젝트에 관련 계정을 여러 개 추가하여 프로젝트 및 관련 유지보수에 계속 액세스할 수 있어야 합니다. 또한, 프로젝트에 관한 알림이나 Google 서비스 업데이트가 있을 경우 해당 계정으로 이메일을 받게 됩니다.']","프로젝트 소유자와 편집자는 최신 상태를 유지해야 하며, 프로젝트에 관련 계정을 여러 개 추가하여 프로젝트 및 관련 유지보수에 계속 액세스할 수 있어야 합니다. 또한, 프로젝트에 관한 알림이나 Google 서비스 업데이트가 있을 경우 해당 계정으로 이메일을 받게 됩니다.",single_hop_specific_query_synthesizer
컴퓨트 엔진 인스턴스에 서비스 어카운트 어떻게 연결하나요?,"['Q: Compute Engine 인스턴스를 생성할 때 서비스 계정을 연결하는 방법은 무엇인가요?\nA: Compute Engine 인스턴스를 생성할 때 서비스 계정을 연결하려면 다음 명령어를 사용하세요:\n```bash\ngcloud compute instances create INSTANCE_NAME --zone=ZONE --service-account=SERVICE_ACCOUNT_EMAIL\n```\nINSTANCE_NAME을 원하는 인스턴스 이름으로, ZONE을 인스턴스를 만들 영역으로, SERVICE_ACCOUNT_EMAIL을 만든 서비스 계정의 이메일 주소로 바꿉니다.']","Compute Engine 인스턴스를 생성할 때 서비스 계정을 연결하려면 다음 명령어를 사용하세요:
```bash
gcloud compute instances create INSTANCE_NAME --zone=ZONE --service-account=SERVICE_ACCOUNT_EMAIL
```
INSTANCE_NAME을 원하는 인스턴스 이름으로, ZONE을 인스턴스를 만들 영역으로, SERVICE_ACCOUNT_EMAIL을 만든 서비스 계정의 이메일 주소로 바꿉니다.",single_hop_specific_query_synthesizer
users/jeff/tasks/my_task_id 문서의 done 필드 색인 크기는 얼마입니까?,['Q: Cloud Firestore에서 done 필드의 색인을 생성하는 컬렉션 그룹 범위가 지정된 단일 필드 색인의 총 크기는 얼마인가요?\nA: done 필드의 색인을 생성하는 컬렉션 그룹 범위가 지정된 단일 필드 색인의 경우 이 색인에 있는 항목의 총 크기는 98바이트입니다.\n\n- 문서 이름 users/jeff/tasks/my_task_id에 44바이트\n- done 필드 이름에 5바이트\n- 부울 필드 값에 1바이트\n- 추가 48바이트'],users/jeff/tasks/my_task_id 문서의 done 필드 색인 크기는 98바이트입니다.,single_hop_specific_query_synthesizer
gcloud CLI 뭐에요 어떻게 써요?,"['Q: gcloud CLI를 사용하여 Cloud Run 함수를 배포한 후 트리거를 만드는 과정은 어떻게 되나요?\nA: 먼저 함수를 배포한 후, 다음 명령어를 실행하여 트리거를 만듭니다.\n\n```bash\ngcloud run deploy FUNCTION \\\n--source . \\\n--function FUNCTION_ENTRYPOINT \\\n--base-image BASE_IMAGE_ID \\\n--region REGION\n```\n\n그 후, 이벤트를 필터링하는 트리거를 생성하는 명령어를 실행합니다.']",gcloud CLI로 함수 배포하고 나서 명령어 실행해서 트리거 만들 수 있습니다.,single_hop_specific_query_synthesizer
Unity에서 Firebase를 추가한 후 Android 빌드 오류를 방지하기 위해 Publishing Settings에서 어떤 설정을 조정해야 하나요?,['Q: Unity 프로젝트에 Firebase를 추가하는 방법은 무엇인가요?\nA: 안내에 따라 Firebase를 Unity 프로젝트에 추가합니다. Unity 인터페이스를 사용하여 Android 빌드를 축소하도록 프로젝트를 구성합니다. Error while merging dex archives 메시지를 방지하려면 빌드를 축소해야 합니다. 이 옵션은 Player Settings(플레이어 설정) > Android > Publishing Settings(게시 설정) > Minify(축소)에서 찾을 수 있습니다.'],Firebase를 Unity 프로젝트에 추가한 후 Error while merging dex archives 메시지를 방지하려면 Player Settings > Android > Publishing Settings > Minify에서 빌드를 축소하도록 설정해야 합니다.,single_hop_specific_query_synthesizer
httsp://firestore.googelapis.com/v1/{name=projects/*/databases/*}:exportDocuments 이거 어떻게 써야되나요?,"['Q: exportDocuments 메서드를 호출할 때, 어떤 HTTP 요청을 사용해야 하나요?\nA: exportDocuments 메서드를 호출할 때는 다음과 같은 HTTP 요청을 사용해야 합니다:\n\n```\nPOST https://firestore.googleapis.com/v1/{name=projects/*/databases/*}:exportDocuments\n```']",exportDocuments 메서드를 사용할 때는 POST https://firestore.googleapis.com/v1/{name=projects/*/databases/*}:exportDocuments 형식의 HTTP 요청을 사용해야 합니다.,single_hop_specific_query_synthesizer
"나 Firebase Authentication 쓰고 싶어요, 근데 Gradle 설정 어떻게 해야돼요? Firebase Android BoM 이거 왜 써야돼요, 뭐에요, 어떻게 쓰는지 알려주세요.",['Q: Firebase Authentication에서 전화번호 로그인을 구현하기 위해 필요한 Gradle 설정은 무엇인가요?\nA: 모듈(앱 수준) Gradle 파일(일반적으로 <project>/<app-module>/build.gradle.kts 또는 <project>/<app-module>/build.gradle)에서 Android용 Firebase Authentication 라이브러리의 종속 항목을 추가해야 합니다. 라이브러리 버전 관리 제어에는 Firebase Android BoM을 사용하는 것이 좋습니다.'],"Firebase Authentication에서 전화번호 로그인을 구현하려면, 모듈(앱 수준) Gradle 파일에 Android용 Firebase Authentication 라이브러리의 종속 항목을 추가해야 합니다. 그리고 라이브러리 버전 관리 제어에는 Firebase Android BoM을 사용하는 것이 좋습니다.",single_hop_specific_query_synthesizer
How use credentials when start Cloud Firestore async client in Python?,['Q: Cloud Firestore를 Python에서 비동기 클라이언트를 사용하여 초기화할 때 사용하는 코드 예시는 무엇인가요?\nA: Cloud Firestore를 Python에서 비동기 클라이언트를 사용하여 초기화하는 방법은 다음과 같습니다.\n\n```python\nimport firebase_admin\nfrom firebase_admin import credentials\nfrom firebase_admin import firestore_async\n\n# Use the application default credentials.\ncred = credentials.ApplicationDefault()\n\nfirebase_admin.initialize_app(cred)\ndb = firestore_async.client()\n```'],"Cloud Firestore를 Python에서 비동기 클라이언트를 사용하여 초기화할 때 credentials.ApplicationDefault()를 사용하여 자격 증명을 설정하고, firebase_admin.initialize_app(cred)로 초기화합니다.",single_hop_specific_query_synthesizer
"클라우드 파이어스토어에서 색인 빌드 타임이 어떻게 정해지는지 잘 모르겠는데, 혹시 클라우드 파이어스토어 색인 빌드 시간은 데이터가 많으면 더 오래 걸리는 건가요? 그리고 색인 빌드 시간에 영향을 주는 요소가 뭐가 있는지 궁금합니다.","['Q: Cloud Firestore에서 색인 빌드 시간은 어떻게 결정되나요?\nA: 색인을 빌드하려면 Cloud Firestore가 색인을 설정한 다음 색인을 기존 데이터로 백필해야 합니다. 색인 빌드 시간은 설정 시간과 백필 시간의 합계입니다. 색인 설정에는 몇 분 정도 걸리며, 색인의 최소 빌드 시간은 비어 있는 데이터베이스인 경우에도 몇 분 정도 걸립니다. 백필 시간은 새 색인에 속하는 기존 데이터의 양에 따라 다릅니다.']","Cloud Firestore에서 색인 빌드 시간은 색인을 설정하는 데 걸리는 시간과 기존 데이터로 색인을 백필하는 데 걸리는 시간의 합계로 결정됩니다. 색인 설정에는 몇 분 정도 걸리며, 데이터베이스가 비어 있어도 최소 빌드 시간은 몇 분 정도 소요됩니다. 백필 시간은 새 색인에 속하는 기존 데이터의 양에 따라 달라집니다.",single_hop_specific_query_synthesizer
Chrome 확장 프로그램에서 앱 소유권을 어떻게 확인하나요?,['Q: Chrome 확장 프로그램의 앱 소유권 확인 절차는 어떻게 진행하나요?\nA: Chrome 확장 프로그램 클라이언트의 앱 소유권 확인 섹션에서 소유권 확인 버튼을 클릭하여 확인 절차를 완료합니다.'],Chrome 확장 프로그램 클라이언트의 앱 소유권 확인 섹션에서 소유권 확인 버튼을 클릭하여 확인 절차를 완료합니다.,single_hop_specific_query_synthesizer
"Me want know, when start new project in Android Studio for YouTube Data API, why need choose Android 4.0, what is reason for pick Android 4.0, can you tell me step and why that version?","[""Q: YouTube Data API를 사용하기 위해 Android 스튜디오에서 새 프로젝트를 어떻게 시작하나요?\nA: Android 스튜디오에서 새 Android 스튜디오 프로젝트를 시작하려면 다음 단계를 따르세요. 1단계: Android 스튜디오를 열고 새 프로젝트 화면에서 애플리케이션 이름을 'Quickstart'로 지정합니다. 2단계: 회사 도메인을 'example.com'으로 설정하고 패키지 이름이 2단계에서 개발자 콘솔에 입력한 이름과 일치하는지 확인합니다. 3단계: Next를 클릭합니다. 4단계: Target Android Devices 화면에서 Phone and Tablet 체크박스를 선택하고 Minimum SDK를 'API 14: Android 4.0(IceCreamSandwich)'로 선택합니다. 5단계: 다른 체크박스는 선택하지 않은 상태로 두고 다음을 클릭합니다. 6단계: Add an activity to Mobile 화면에서 Add No Activity를 클릭합니다. 7단계: 마침을 클릭합니다.""]","You need to select 'API 14: Android 4.0(IceCreamSandwich)' as the Minimum SDK on the Target Android Devices screen when starting a new Android Studio project for YouTube Data API. This step is specified in the instructions to ensure compatibility, as indicated in step 4 of the provided context.",single_hop_specific_query_synthesizer
YouTube API를 활용하여 기존 동영상의 제목과 설명을 업데이트하는 방법에 대해 자세히 설명해 주시겠습니까?,"[""Q: 동영상을 업데이트하는 방법은 무엇인가요?\nA: 동영상을 업데이트하려면 `videos.update` 메서드를 사용합니다. 아래는 Apps Script를 사용한 코드 샘플입니다.\n\n```javascript\n// Update a video\nfunction updateVideo() {\n  var request = YouTube.Videos.update({\n    id: 'VIDEO_ID',\n    snippet: {\n      title: 'Updated Title',\n      description: 'Updated Description'\n    }\n  }, 'snippet');\n  Logger.log(request);\n}\n```""]","YouTube API에서 기존 동영상의 제목과 설명을 업데이트하려면 `videos.update` 메서드를 사용해야 합니다. Apps Script를 활용한 예시 코드는 다음과 같습니다. 먼저, `YouTube.Videos.update` 함수를 호출하고, 업데이트할 동영상의 ID와 함께 새로운 제목과 설명이 포함된 snippet 객체를 전달합니다. 예를 들어, 아래와 같이 작성할 수 있습니다.

```javascript
// Update a video
function updateVideo() {
  var request = YouTube.Videos.update({
    id: 'VIDEO_ID',
    snippet: {
      title: 'Updated Title',
      description: 'Updated Description'
    }
  }, 'snippet');
  Logger.log(request);
}
```
이 코드는 지정한 동영상의 제목과 설명을 새로운 값으로 변경하며, 업데이트 결과는 Logger를 통해 확인할 수 있습니다.",single_hop_specific_query_synthesizer
OAuth 2.0 리디렉션 URI 뭐 조심해야 돼요?,"[""Q: Flask에서 OAuth 2.0 인증 흐름 중 리디렉션 URI를 설정할 때 주의해야 할 유효성 검사 규칙은 무엇인가요?\nA: 리디렉션 URI는 일반 HTTP가 아닌 HTTPS 체계를 사용해야 하며, 로컬 호스트 URI는 이 규칙에서 제외됩니다. 또한, 호스트는 원시 IP 주소일 수 없고, 'googleusercontent.com' 도메인은 사용할 수 없습니다. 리디렉션 URI에는 userinfo 하위 구성요소가 포함될 수 없으며, 경로에는 '/..' 또는 해당 URL 인코딩으로 표시되는 경로 순회가 포함될 수 없습니다.""]","리디렉션 URI는 HTTPS를 써야 하고, 로컬 호스트만 예외예요. 호스트에 IP 주소 쓰면 안 되고, 'googleusercontent.com' 도메인도 안 돼요. userinfo 들어가면 안 되고, 경로에 '/..' 같은 거 있으면 안 돼요.",single_hop_specific_query_synthesizer
ouath 2.0 슬라이드 api 쓸때 뭐써야되요?,"['Q: Google Slides API에서 모든 Google Slides 프레젠테이션을 확인, 수정, 생성, 삭제하기 위해 필요한 OAuth 2.0 범위는 무엇인가요?\nA: Google Slides API에서 모든 Google Slides 프레젠테이션을 확인, 수정, 생성, 삭제하기 위해 필요한 OAuth 2.0 범위는 https://www.googleapis.com/auth/presentations입니다.']","Google Slides API에서 모든 Google Slides 프레젠테이션을 확인, 수정, 생성, 삭제하기 위해 필요한 OAuth 2.0 범위는 https://www.googleapis.com/auth/presentations입니다.",single_hop_specific_query_synthesizer
firebaseAuth how check got pending result during login?,"['Q: 로그인 과정 중 대기 중인 결과가 있는지 확인하는 방법은 무엇인가요?\nA: 대기 중인 결과가 있는지 확인하려면 다음과 같이 getPendingAuthResult를 호출합니다. 예를 들어, Kotlin에서는 다음과 같이 작성합니다:\n```kotlin\nval pendingResultTask = firebaseAuth.pendingAuthResult\nif (pendingResultTask != null) {\n```']","To check if there is a pending result during login, call getPendingAuthResult like this: val pendingResultTask = firebaseAuth.pendingAuthResult. If pendingResultTask is not null, then there is a pending result.",single_hop_specific_query_synthesizer
REST API에서 google.rpc.Status를 사용하는 주요 이유는 무엇입니까?,['Q: google.rpc.Status를 사용하는 이유는 무엇인가요?\nA: google.rpc.Status는 REST API와 RPC API를 포함한 다양한 프로그래밍 환경에 적합한 논리적 오류 모델을 정의합니다.'],google.rpc.Status는 REST API와 RPC API를 포함한 다양한 프로그래밍 환경에 적합한 논리적 오류 모델을 정의하기 위해 사용됩니다.,single_hop_specific_query_synthesizer
gcluod 명령어로 벡터 색인 만들때 필드-패스는 뭐에요?,"['Q: gcloud 명령어로 벡터 색인을 만들 때 필요한 필드 구성 요소는 무엇인가요?\nA: gcloud 명령어로 벡터 색인을 만들 때 필요한 필드 구성 요소는 다음과 같습니다:\n- `field-path`: 벡터 임베딩이 포함된 필드의 이름입니다.\n- `vector-config`: 색인 구성의 형식으로, dimension 벡터와 색인 유형이 포함됩니다. 예를 들어, `vector-config=\'{""dimension"":""1024"", ""flat"": ""{}""}\'`와 같이 설정합니다.']",field-path는 벡터 임베딩이 포함된 필드의 이름입니다.,single_hop_specific_query_synthesizer
GithbAuthProvider를 firebase에서 쓰려면 어떻게 해야하나요? GithbAuthProvider랑 GithubAuthProvider 차이점도 알려주세요.,"['Q: auth/account-exists-with-different-credential 오류를 처리하는 방법은 무엇인가요?\nA: auth/account-exists-with-different-credential 오류는 사용자가 다른 Firebase 사용자의 제공업체에 이미 존재하는 이메일을 사용하여 GitHub와 같은 제공업체에 로그인을 시도할 때 발생합니다. 이 오류를 처리하려면 다음과 같은 코드를 사용할 수 있습니다.\n\n```javascript\nimport { getAuth, linkWithCredential, signInWithPopup, GithubAuthProvider } from ""firebase/auth"";\n\nconst provider = new GithubAuthProvider();\nconst auth = getAuth();\n\nsignInWithPopup(auth, provider)\n  .then((result) => {\n    // 사용자 인증 정보 처리\n  })\n  .catch((error) => {\n    if (error.code === \'auth/account-exists-with-different-credential\') {\n      // 기존 제공업체에 로그인 후 신규 제공업체의 AuthCredential에 연결\n    }\n  });\n```']","GithubAuthProvider는 firebase/auth 모듈에서 import하여 사용할 수 있습니다. 예시 코드에서는 import { getAuth, linkWithCredential, signInWithPopup, GithubAuthProvider } from ""firebase/auth"";와 같이 GithubAuthProvider를 불러와 사용합니다. GithbAuthProvider는 오타이며, 올바른 이름은 GithubAuthProvider입니다.",single_hop_specific_query_synthesizer
DIMENSION_UNSPECIFID 뭐에요?,['Q: Dimension API에서 사용할 수 있는 열거형 값은 무엇인가요?\nA: Dimension API에서 사용할 수 있는 열거형 값은 다음과 같습니다: \n- DIMENSION_UNSPECIFIED: 기본값이며 사용할 수 없습니다.\n- ROWS: 시트의 행에서 작동합니다.\n- COLUMNS: 시트의 열에서 작동합니다.'],DIMENSION_UNSPECIFIED는 Dimension API의 기본값이며 사용할 수 없습니다.,single_hop_specific_query_synthesizer
